{
  "label": "MODELLED: truth is the measured IGS final 30 s clock (decimated to 300 s) of the satellites in the split; the IGS files do not state the clock type",
  "metrics": {
    "n_cases": 104,
    "per_horizon": [
      {
        "bias_ns": -0.0023201046713312388,
        "horizon_s": 300,
        "mae_ns": 0.01853217131648824,
        "rmse_ns": 0.024039397291784694
      },
      {
        "bias_ns": -0.00555368398662286,
        "horizon_s": 900,
        "mae_ns": 0.04444755198933406,
        "rmse_ns": 0.05309022542154047
      },
      {
        "bias_ns": -0.0000752031477355099,
        "horizon_s": 3600,
        "mae_ns": 0.16385259441578584,
        "rmse_ns": 0.18345267224077627
      },
      {
        "bias_ns": 0.04569956578377753,
        "horizon_s": 7200,
        "mae_ns": 0.2592666408129902,
        "rmse_ns": 0.2898255390888113
      }
    ],
    "primary_rmse_3600_ns": 0.18345267224077627
  },
  "notice": "Advisory: modelled or measured against stated references, not an approval, certification or statement of conformance. A score describes a log or corpus, never a product.",
  "predictions_sha256": "fb0056fb705f10177c47f5772aa823f9a4a99358a9104d983c3006bf4418bc1f",
  "provenance": "scored",
  "schema": "kshana-bench-result/1",
  "spec_version": "kshana-bench/1.0.0",
  "split": "test",
  "system": {
    "name": "kshana-bench baseline: quadratic",
    "version": "kshana-bench/1.0.0"
  },
  "task": "c",
  "truth_sha256": "e7170a72eb9b81193e302b3b4d39279c8416cbf97a156d005e14b68091761fbf"
}
