{
  "label": "MODELLED: labels are generative-model labels of a synthetic parameter-grounded corpus (never field or IQ data); an AUC here is an AUC over model-derived labels",
  "metrics": {
    "auc_in": 0.60965625,
    "auc_out": 0.57153125,
    "ood_severity_scale": 0.5,
    "operating_in": {
      "n": 1000,
      "pd": 0.255,
      "pfa": 0.05,
      "target_pfa": 0.05
    },
    "operating_out": {
      "n": 1000,
      "pd": 0.18625,
      "pfa": 0.05,
      "target_pfa": 0.05
    },
    "optimism_gap": 0.038124999999999964,
    "optimism_tol": 0.05,
    "optimistic": false
  },
  "notice": "Advisory: modelled or measured against stated references, not an approval, certification or statement of conformance. A score describes a log or corpus, never a product.",
  "predictions_sha256": "7a39157f3ef35776bb6b7ec80496e37e2d3593cf6684ba0cf5a7a8355e3bde78",
  "provenance": "scored",
  "schema": "kshana-bench-result/1",
  "spec_version": "kshana-bench/1.0.0",
  "split": "dev",
  "system": {
    "name": "impairment-eval baseline: energy(cn0-drop)",
    "version": "kshana-bench/1.0.0"
  },
  "task": "d",
  "truth_sha256": "60acd133a0100523cdf82e128599d3e58fac73c6e75a777b949199f88b74a3df"
}
